Rank,Title,Author,Rating,Number of Ratings,Date,Description,Reviews,Pages,Cover Type,Score
26,The Alchemist,Paulo Coelho,3.91,"3,182,340","First published January 1, 1988","Paulo Coelho's masterpiece tells the mystical story of Santiago, an Andalusian shepherd boy who yearns to travel in search of a worldly treasure. His quest will lead him to riches far different, and far more satisfying, listening to our hearts, of recognizing opportunity and learning to read the omens strewn along life's path, and, most importantly, to follow our dreams.","126,908",197,Paperback,"920,276"
1,"The Hunger Games (The Hunger Games, #1)",Suzanne Collins,4.34,"8,957,477","First published September 14, 2008","In the ruins of a place once known as North America lies the nation of Panem, a shining Capitol surrounded by twelve outlying districts. The Capitol is harsh and cruel and keeps the districts in line by forcing them all to send one boy and one girl between the ages of twelve and eighteen to participate in the annual Hunger Games, a fight to the death on live TV.","225,244",374,Hardcover,"3,905,463"
22,Alice’s Adventures in Wonderland / Through the Looking-Glass,Lewis Carroll,4.06,"576,089","First published December 27, 1871","""I can't explain myself, I'm afraid, sir,"" said Alice, ""Because I'm not myself, you see.""","16,150",239,Paperback,"967,102"
23,"Divergent (Divergent, #1)",Veronica Roth,4.14,"4,088,521","First published April 25, 2011","In Beatrice Prior's dystopian Chicago world, society is divided into five factions, each dedicated to the cultivation of a particular virtue—Candor (the honest), Abnegation (the selfless), Dauntless (the brave), Amity (the peaceful), and Erudite (the intelligent). On an appointed day of every year, all sixteen-year-olds must select the faction to which they will devote the rest of their lives. For Beatrice, the decision is between staying with her family and being who she really is—she can't have both. So she makes a choice that surprises everyone, including herself.","122,769",487,Paperback,"956,565"
27,Lord of the Flies,William Golding,3.70,"2,976,980","First published September 17, 1954","At the dawn of the next world war, a plane crashes on an uncharted island, stranding a group of schoolboys. At first, with no adult supervision, their freedom is something to celebrate; this far from civilization the boys can do anything they want. Anything. They attempt to forge their own society, failing, however, in the face of terror, sin and evil. And as order collapses, as strange howls echo in the night, as terror begins its reign, the hope of adventure seems as far from reality as the hope of being rescued. Labeled a parable, an allegory, a myth, a morality tale, a parody, a political treatise, even a vision of the apocalypse, Lord of the Flies is perhaps our most memorable novel about “the end of innocence, the darkness of man’s heart.”","58,642",182,Paperback,"901,960"
21,Crime and Punishment,Fyodor Dostoevsky,4.27,"941,597","First published January 1, 1866","Raskolnikov, a destitute and desperate former student, wanders through the slums of St Petersburg and commits a random murder without remorse or regret. He imagines himself to be a great man, a Napoleon: acting for a higher purpose beyond conventional moral law. But as he embarks on a dangerous game of cat and mouse with a suspicious police investigator, Raskolnikov is pursued by the growing voice of his conscience and finds the noose of his own guilt tightening around his neck. Only Sonya, a downtrodden sex worker, can offer the chance of redemption.","39,898",671,Paperback,"975,153"
24,Memoirs of a Geisha,Arthur Golden,4.15,"2,031,198","First published September 23, 1997","A literary sensation and runaway bestseller, this brilliant novel presents with seamless authenticity and exquisite lyricism the true confessions of one of Japan's most celebrated geisha.","36,883",503,Mass Market Paperback,"943,432"
25,Les Misérables,Victor Hugo,4.20,"809,155","First published January 1, 1862","Victor Hugo's tale of injustice, heroism and love follows the fortunes of Jean Valjean, an escaped convict determined to put his criminal past behind him. But his attempts to become a respected member of the community are constantly put under threat: by his own conscience, when, owing to a case of mistaken identity, another man is arrested in his place; and by the relentless investigations of the dogged Inspector Javert. It is not simply for himself that Valjean must stay free, however, for he has sworn to protect the baby daughter of Fantine, driven to prostitution by poverty.","23,413",1463,Mass Market Paperback,"928,820"
19,The Great Gatsby,F. Scott Fitzgerald,3.93,"5,394,297","First published April 10, 1925",", F. Scott Fitzgerald's third book, stands as the supreme achievement of his career. This exemplary novel of the Jazz Age has been acclaimed by generations of readers. The story of the fabulously wealthy Jay Gatsby and his love for the beautiful Daisy Buchanan, of lavish parties on Long Island at a time when ","110,917",180,Paperback,"1,038,052"
20,"The Da Vinci Code (Robert Langdon, #2)",Dan       Brown,3.92,"2,395,757","First published January 1, 2003",Alternate covers for 9780307277671 can be found:,"55,992",489,Paperback,"991,887"
17,Jane Eyre,Charlotte Brontë,4.15,"2,143,677","First published October 16, 1847",.,"68,375",532,Paperback,"1,073,444"
18,The Little Prince,Antoine de Saint-Exupéry,4.33,"2,185,883","First published January 1, 1943","A pilot stranded in the desert awakes one morning to see, standing before him, the most extraordinary little fellow. ""Please,"" asks the stranger, ""draw me a sheep."" And the pilot realizes that when life's events are too difficult to understand, there is no choice but to succumb to their mysteries. He pulls out pencil and paper... And thus begins this wise and enchanting fable that, in teaching the secret of what is really important in life, has changed forever the world for its readers.","71,885",96,Paperback,"1,052,816"
16,The Lightning Thief (Percy Jackson and the Olympians #1),Rick Riordan,4.31,"3,138,017","First published July 28, 2005","Percy Jackson is a good kid, but he can't seem to focus on his schoolwork or control his temper. And lately, being away at boarding school is only getting worse - Percy could have sworn his pre-algebra teacher turned into a monster and tried to kill him. When Percy's mom finds out, she knows it's time that he knew the truth about where he came from, and that he go to the one place he'll be safe. She sends Percy to Camp Half Blood, a summer camp for demigods (on Long Island), where he learns that the father he never knew is Poseidon, God of the Sea. Soon a mystery unfolds and together with his friends—one a satyr and the other the demigod daughter of Athena - Percy sets out on a quest across the United States to reach the gates of the Underworld (located in a recording studio in Hollywood) and prevent a catastrophic war between the gods.","107,870",377,Paperback,"1,100,489"
14,Gone with the Wind,Margaret Mitchell,4.31,"1,233,145","First published June 30, 1936","Scarlett O'Hara, the beautiful, spoiled daughter of a well-to-do Georgia plantation owner, must use every means at her disposal to claw her way out of the poverty she finds herself in after Sherman's March to the Sea.","25,493",1037,Mass Market Paperback,"1,172,068"
13,Wuthering Heights,Emily Brontë,3.89,"1,863,062","First published December 1, 1847",At the centre of this novel is the passionate love between Catherine Earnshaw and Heathcliff - recounted with such emotional intensity that a plain tale of the Yorkshire moors acquires the depth and simplicity of ancient tragedy.,"65,678",464,Paperback,"1,179,291"
15,The Perks of Being a Wallflower,Stephen Chbosky,4.23,"1,851,187","First published February 1, 1999",standing on the fringes of life...,"96,007",213,Paperback,"1,104,681"
100,The Poisonwood Bible,Barbara Kingsolver,4.10,"756,980","First published September 24, 1998"," is a story told by the wife and four daughters of Nathan Price, a fierce, evangelical Baptist who takes his family and mission to the Belgian Congo in 1959. They carry with them everything they believe they will need from home, but soon find that all of it -- from garden seeds to Scripture -- is calamitously transformed on African soil. What follows is a suspenseful epic of one family's tragic undoing and remarkable reconstruction over the course of three decades in postcolonial Africa.","28,622",546,Paperback,"290,019"
99,The Old Man and the Sea,Ernest Hemingway,3.80,"1,190,344","First published September 1, 1952","This short novel, already a modern classic, is the superbly told, tragic story of a Cuban fisherman in the Gulf Stream and the giant Marlin he kills and loses—specifically referred to in the citation accompanying the author's Nobel Prize for literature in 1954.","42,145",96,Hardcover,"292,472"
97,"Interview with the Vampire (The Vampire Chronicles, #1)",Anne Rice,4.02,"605,251","First published April 12, 1976","This is the story of Louis, as told in his own words, of his journey through mortal and immortal life. Louis recounts how he became a vampire at the hands of the radiant and sinister Lestat and how he became indoctrinated, unwillingly, into the vampire way of life. His story ebbs and flows through the streets of New Orleans, defining crucial moments such as his discovery of the exquisite lost young child Claudia, wanting not to hurt but to comfort her with the last breaths of humanity he has inside. Yet, he makes Claudia a vampire, trapping her womanly passion, will, and intelligence inside the body of a small child. Louis and Claudia form a seemingly unbreakable alliance and even ""settle down"" for a while in the opulent French Quarter. Louis remembers Claudia's struggle to understand herself and the hatred they both have for Lestat that sends them halfway across the world to seek others of their kind. Louis and Claudia are desperate to find somewhere they belong, to find others who understand, and someone who knows what and why they are.","17,714",346,Paperback,"299,541"
98,Don Quixote,Miguel de Cervantes Saavedra,3.90,"280,462","First published January 1, 1605","Don Quixote has become so entranced by reading chivalric romances that he determines to become a knight-errant himself. In the company of his faithful squire, Sancho Panza, his exploits blossom in all sorts of wonderful ways. While Quixote's fancy often leads him astray—he tilts at windmills, imagining them to be giants—Sancho acquires cunning and a certain sagacity. Sane madman and wise fool, they roam the world together, and together they have haunted readers' imaginations for nearly four hundred years.","12,663",1023,Paperback,"296,906"
95,"Angela’s Ashes (Frank McCourt, #1)",frank-mccourt,4.15,"637,505","First published September 5, 1996",Imbued on every page with Frank McCourt's astounding humor and compassion. This is a glorious book that bears all the marks of a classic.,"14,609",452,Paperback,"305,764"
96,The Complete Stories and Poems,Edgar Allan Poe,4.40,"279,572","First published November 1, 1849","This single volume brings together all of Poe's stories and poems, and illuminates the diverse and multifaceted genius of one of the greatest and most influential figures in American literary history.","3,320",821,Hardcover,"304,231"
94,Siddhartha,Hermann Hesse,4.07,"795,626","First published October 1, 1922","Herman Hesse's classic novel has delighted, inspired, and influenced generations of readers, writers, and thinkers. In this story of a wealthy Indian Brahmin who casts off a life of privilege to seek spiritual fulfillment. Hesse synthesizes disparate philosophies--Eastern religions, Jungian archetypes, Western individualism--into a unique vision of life as expressed through one man's search for true meaning.","28,671",152,Mass Market Paperback,"310,464"
91,"The Golden Compass (His Dark Materials, #1)",Philip Pullman,4.02,"1,550,794","First published July 1, 1995","Lyra is rushing to the cold, far North, where witch clans and armored bears rule. North, where the Gobblers take the children they steal--including her friend Roger. North, where her fearsome uncle Asriel is trying to build a bridge to a parallel world.","28,433",399,Hardcover,"315,676"
93,"Vampire Academy (Vampire Academy, #1)",Richelle Mead,4.11,"656,184","First published August 16, 2007","Lissa Dragomir is a Moroi princess: a mortal vampire with a rare gift for harnessing the earth's magic. She must be protected at all times from Strigoi; the fiercest vampires—the ones who never die. The powerful blend of human and vampire blood that flows through Rose Hathaway, Lissa's best friend, makes her a dhampir. Rose is dedicated to a dangerous life of protecting Lissa from the Strigoi, who are hell-bent on making Lissa one of them.","27,117",332,Paperback,"311,506"
90,It,Stephen         King,4.24,"1,151,746","First published September 15, 1986","Welcome to Derry, Maine ...","37,557",1116,Paperback,"316,918"
88,The Road,Cormac McCarthy,3.99,"937,494","First published September 26, 2006","A searing, postapocalyptic novel destined to become Cormac McCarthy’s masterpiece.","62,646",241,Hardcover,"333,547"
89,To Kill a Mockingbird,Harper Lee,4.26,"6,327,305","First published July 11, 1960","'Shoot all the bluejays you want, if you can hit 'em, but remember it's a sin to kill a mockingbird.'","121,142",323,Paperback,"326,111"
87,A Clockwork Orange,Anthony Burgess,4.00,"727,950","First published January 1, 1962","In Anthony Burgess's influential nightmare vision of the future, criminals take over after dark. Teen gang leader Alex narrates in fantastically inventive slang that echoes the violent intensity of youth rebelling against society. Dazzling and transgressive, ","21,794",240,Paperback,"340,016"
92,"The Shining (The Shining, #1)",Stephen         King,4.27,"1,542,046","First published January 28, 1977","Jack Torrance's new job at the Overlook Hotel is the perfect chance for a fresh start. As the off-season caretaker at the atmospheric old hotel, he'll have plenty of time to spend reconnecting with his family and working on his writing. But as the harsh winter weather sets in, the idyllic location feels ever more remote...and more sinister. And the only one to notice the strange and terrible forces gathering around the Overlook is Danny Torrance, a uniquely gifted five-year-old.","41,104",497,Paperback,"313,277"
85,A Tree Grows in Brooklyn,Betty  Smith,4.30,"477,561","First published August 18, 1943","The beloved American classic about a young girl's coming-of-age at the turn of the century, Betty Smith's ","28,486",496,Paperback,"343,422"
86,And Then There Were None,Agatha Christie,4.28,"1,421,021","First published November 6, 1939","First, there were ten—a curious assortment of strangers summoned as weekend guests to a little private island off the coast of Devon. Their host, an eccentric millionaire unknown to all of them, is nowhere to be found. All that the guests have in common is a wicked past they're unwilling to reveal—and a secret that will seal their fate. For each has been marked for murder. A famous nursery rhyme is framed and hung in every room of the mansion:","68,954",264,Paperback,"340,605"
84,The Brothers Karamazov,Fyodor Dostoevsky,4.37,"345,640","First published January 1, 1880","The Brothers Karamazov is a murder mystery, a courtroom drama, and an exploration of erotic rivalry in a series of triangular love affairs involving the “wicked and sentimental” Fyodor Pavlovich Karamazov and his three sons―the impulsive and sensual Dmitri; the coldly rational Ivan; and the healthy, red-cheeked young novice Alyosha. Through the gripping events of their story, Dostoevsky portrays the whole of Russian life, is social and spiritual striving, in what was both the golden age and a tragic turning point in Russian culture.","20,379",796,Paperback,"357,743"
197,"The Silence of the Lambs  (Hannibal Lecter, #2)",Thomas  Harris,4.25,"559,016","First published July 1, 1988","A serial murderer known only by a grotesquely apt nickname—Buffalo Bill—is stalking women. He has a purpose, but no one can fathom it, for the bodies are discovered in different states. Clarice Starling, a young trainee at the FBI Academy, is surprised to be summoned by Jack Crawford, chief of the Bureau's Behavioral Science section. Her assignment: to interview Dr. Hannibal Lecter—Hannibal the Cannibal—who is kept under close watch in the Baltimore State Hospital for the Criminally Insane.","10,193",421,Paperback,"90,097"
200,The Neverending Story,Michael Ende,4.18,"206,625","First published September 1, 1979",This epic work of the imagination has captured the hearts of millions of readers worldwide since it was first published. Its special story within a story is an irresistible invitation for readers to become part of the book itself. ,"9,983",396,Hardcover,"88,488"
196,The Joy Luck Club,Amy Tan,3.97,"690,796","First published January 1, 1989","Four mothers, four daughters, four families, whose histories shift with the four winds depending on who's telling the stories. In 1949, four Chinese women, recent immigrants to San Francisco, meet weekly to play mahjong and tell stories of what they left behind in China. United in loss and new hope for their daughters' futures, they call themselves the Joy Luck Club. Their daughters, who have never heard these stories, think their mothers' advice is irrelevant to their modern American lives – until their own inner crises reveal how much they've unknowingly inherited of their mothers' pasts. ","13,866",352,Paperback,"90,278"
198,The Phantom Tollbooth,Norton Juster,4.20,"292,523","First published January 1, 1961",This beloved story -first published more than fifty years ago- introduces readers to Milo and his adventures in the Lands Beyond. ,"13,760",248,Paperback,"89,905"
199,"Oh, the Places You’ll Go!",Dr. Seuss,4.37,"416,459","First published January 22, 1990","In his inimitable, humorous verse and pictures, he addresses the Great Balancing Act (life itself, and the ups and downs it presents) while encouraging us to find the success that lies within us.","6,570",44,Hardcover,"89,455"
195,Alice in Wonderland,Jane Carruth,4.03,"392,202","First published January 1, 1865",.,"5,611",96,Hardcover,"90,519"
194,"The Good Earth (House of Earth, #1)",Pearl S. Buck,4.00,"252,782","First published March 2, 1931","This tells the poignant tale of a Chinese farmer and his family in old agrarian China. The humble Wang Lung glories in the soil he works, nurturing the land as it nurtures him and his family. Nearby, the nobles of the House of Hwang consider themselves above the land and its workers; but they will soon meet their own downfall.","11,935",418,Paperback,"90,899"
193,The Night Circus,Erin Morgenstern,4.01,"1,009,327","First published September 13, 2011","The circus arrives without warning. No announcements precede it. It is simply there, when yesterday it was not. Within the black-and-white striped canvas tents is an utterly unique experience full of breathtaking amazements. It is called Le Cirque des Rêves, and it is only open at night. ","107,655",506,Hardcover,"91,056"
192,"The Selection (The Selection, #1)",Kiera Cass,4.08,"1,613,929","First published April 24, 2012","For thirty-five girls, the Selection is the chance of a lifetime. The opportunity to escape the life laid out for them since birth. To be swept up in a world of glittering gowns and priceless jewels. To live in a palace and compete for the heart of gorgeous Prince Maxon.","81,774",336,Hardcover,"91,199"
190,"Blood Promise (Vampire Academy, #4)",Richelle Mead,4.30,"317,468","First published August 25, 2009","The world thought Dimitri was dead. And to a certain extent, he was. But I hadn't been able to forget a conversation he and I had once had. We'd both agreed that we'd rather be dead - truly dead - than walk the world as Strigoi. It was time to honor our words.","11,564",503,Hardcover,"92,460"
191,The Call of the Wild,Jack London,3.91,"441,137","First published January 1, 1903","First published in 1903, ","16,213",172,Mass Market Paperback,"91,747"
189,The Prophet,Kahlil Gibran,4.23,"306,545","First published January 1, 1923","Kahlil Gibran’s masterpiece, ","15,135",127,Paperback,"93,129"
185,"A Court of Mist and Fury (A Court of Thorns and Roses, #2)",Sarah J. Maas,4.65,"2,307,530","First published May 3, 2016","Feyre survived Amarantha's clutches to return to the Spring Court—but at a steep cost. Though she now has the powers of the High Fae, her heart remains human, and it can't forget the terrible deeds she performed to save Tamlin's people.","196,537",626,Kindle Edition,"96,553"
187,Heart of Darkness,Joseph Conrad,3.43,"523,651","First published January 1, 1899","Heart of Darkness, a novel by Joseph Conrad, was originally a three-part series in Blackwood's Magazine in 1899. It is a story within a story, following a character named Charlie Marlow, who recounts his adventure to a group of men onboard an anchored ship. The story told is of his early life as a ferry boat captain. Although his job was to transport ivory downriver, Charlie develops an interest in investing an ivory procurement agent, Kurtz, who is employed by the government. Preceded by his reputation as a brilliant emissary of progress, Kurtz has now established himself as a god among the natives in “one of the darkest places on earth.” Marlow suspects something else of Kurtz: he has gone mad.","21,470",188,Paperback,"95,600"
186,Bridge to Terabithia,Katherine Paterson,4.05,"558,148","First published October 21, 1977", ,"17,011",190,Kindle Edition,"95,779"
184,"Murder on the Orient Express (Hercule Poirot, #10)",Agatha Christie,4.20,"650,332","First published January 1, 1934","Just after midnight, a snowdrift stops the famous Orient Express in its tracks as it travels through the mountainous Balkans. The luxurious train is surprisingly full for the time of the year but, by the morning, it is one passenger fewer. An American tycoon lies dead in his compartment, stabbed a dozen times, his door locked from the inside.","42,430",274,Paperback,"96,600"
299,Blood River: A Journey to Africa’s Broken Heart,Tim Butcher,3.98,"11,557","First published July 3, 2007",A compulsively readable account of a journey to the Congo — a country virtually inaccessible to the outside world — vividly told by a daring and adventurous journalist.,846,363,Paperback,"50,415"
298,"Beautiful Disaster (Beautiful, #1)",Jamie McGuire,4.01,"694,607","First published May 26, 2011","The new Abby Abernathy is a good girl. She doesn’t drink or swear, and she has the appropriate number of cardigans in her wardrobe. Abby believes she has enough distance from the darkness of her past, but when she arrives at college with her best friend, her path to a new beginning is quickly challenged by Eastern University's Walking One-Night Stand. ","34,872",432,Kindle Edition,"50,540"
295,The Things They Carried,Tim O'Brien,4.14,"322,668","First published March 28, 1990","A classic work of American literature that has not stopped changing minds and lives since it burst onto the literary scene, The Things They Carried is a ground-breaking meditation on war, memory, imagination, and the redemptive power of storytelling. ","19,551",246,Paperback,"51,188"
297,Uncle Tom’s Cabin,Harriet Beecher Stowe,3.91,"231,098","First published January 1, 1852","The narrative drive of Stowe's classic novel is often overlooked in the heat of the controversies surrounding its anti-slavery sentiments. In fact, it is a compelling adventure story with richly drawn characters and has earned a place in both literary and American history. Stowe's religious beliefs show up in the novel's final, overarching theme—the exploration of the nature of Christianity and how Christian theology is fundamentally incompatible with slavery.","10,110",438,Paperback,"50,549"
300,Never Let Me Go,Kazuo Ishiguro,3.85,"733,573","First published April 5, 2005","Hailsham seems like a pleasant English boarding school, far from the influences of the city. Its students are well tended and supported, trained in art and literature, and become just the sort of people the world wants them to be. But, curiously, they are taught nothing of the outside world and are allowed little contact with it.","57,628",288,Paperback,"49,994"
293,"Delirium (Delirium, #1)",Lauren Oliver,3.95,"470,769","First published February 3, 2011","In an alternate United States, love has been declared a dangerous disease, and the government forces everyone who reaches eighteen to have a procedure called the Cure. Living with her aunt, uncle, and cousins in Portland, Maine, Lena Haloway is very much looking forward to being cured and living a safe, predictable life. She watched love destroy her mother and isn't about to make the same mistake.","28,952",441,Paperback,"51,248"
188,Tess of the D’Urbervilles,Thomas Hardy,3.83,"289,219","First published January 1, 1891",Alternate covers can be found ,"12,250",518,Paperback,"95,235"
294,Invisible Man,Ralph Ellison,3.91,"191,857","First published April 14, 1952","First published in 1952 and immediately hailed as a masterpiece, ","8,658",581,Paperback,"51,194"
292,King Lear,William Shakespeare,3.91,"223,863","First published January 1, 1605","Shakespeare’s King Lear challenges us with the magnitude, intensity, and sheer duration of the pain that it represents. Its figures harden their hearts, engage in violence, or try to alleviate the suffering of others. Lear himself rages until his sanity cracks. What, then, keeps bringing us back to King Lear? For all the force of its language, King Lear is almost equally powerful when translated, suggesting that it is the story, in large part, that draws us to the play.","7,383",339,Mass Market Paperback,"51,359"
