Rank,Title,Author,Rating,Number of Ratings,Date,Description,Reviews,Pages,Cover Type,Score
921,Revolutionary Road,Richard Yates,3.93,"89,662","First published December 31, 1961","In the hopeful 1950s, Frank and April Wheeler appear to be a model American couple: bright, beautiful, talented, with two young children and a starter home in the suburbs. Perhaps they married too young and started a family too early. Maybe Frank's job is dull. And April never saw herself as a housewife. Yet they have always lived on the assumption that greatness is only just around the corner. But now that certainty is now about to crumble. With heartbreaking compassion and remorseless clarity, Richard Yates shows how Frank and April mortgage their spiritual birthright, betraying not only each other, but their best selves.","7,748",355,Paperback,"9,436"
929,The Hotel New Hampshire,John Irving,3.93,"66,464","First published January 1, 1981","“The first of my father’s illusions was that bears could survive the life lived by human beings, and the second was that human beings could survive a life led in hotels.” So says John Berry, son of a hapless dreamer, brother to a cadre of eccentric siblings, and chronicler of the lives lived, the loves experienced, the deaths met, and the myriad strange and wonderful times encountered by the family Berry. Hoteliers, pet-bear owners, friends of Freud (the animal trainer and vaudevillian, that is), and playthings of mad fate, they “dream on” in a funny, sad, outrageous, and moving novel by the remarkable author of A Prayer for Owen Meany and Last Night in Twisted River.","2,167",520,Paperback,"9,307"
931,"The Awakening (Darkest Powers, #2)",Kelley Armstrong,4.14,"116,268","First published April 28, 2009","If you had met me a few weeks ago, you probably would have described me as an average teenage girl - someone normal. Now my life has changed forever and I’m as far away from normal as it gets. A living science experiment - not only can I see ghosts, but I was genetically altered by a sinister organization called Edison Group. What does that mean? For starters. I'm a teenage necromancer whose powers are out of control: I raise the dead without even trying. Trust me, that is not a power you want to have. Ever.","3,516",360,Hardcover,"9,279"
919,The Maltese Falcon,Dashiell Hammett,3.87,"109,295","First published January 1, 1930","Sam Spade is hired by the fragrant Miss Wonderley to track down her sister, who has eloped with a louse called Floyd Thursby. But Miss Wonderley is in fact the beautiful and treacherous Brigid O'Shaughnessy, and when Spade's partner Miles Archer is shot while on Thursby's trail, Spade finds himself both hunter and hunted: can he track down the jewel-encrusted bird, a treasure worth killing for, before the Fat Man finds him?","6,797",213,Paperback,"9,475"
917,Marked by Magic (Tracking Trouble #1),Lindsay Buroker,4.33,"4,299","First published November 9, 2023","Arwen Forester may be a socially awkward introvert, but she’s an expert tracker, archer, and forager who has a pickling recipe for every vegetable in the garden. Unfortunately, none of these skills earn her a lot of money. And when the taxes go up on her father’s farm, she’s not sure how to help him keep the property.",168,342,Kindle Edition,"9,516"
924,"The City of Ember (Book of Ember, #1)",Jeanne DuPrau,3.89,"286,884","First published May 13, 2003","Many hundreds of years ago, the city of Ember was created by the Builders to contain everything needed for human survival. It worked…but now the storerooms are almost out of food, crops are blighted, corruption is spreading through the city and worst of all—the lights are failing. Soon Ember could be engulfed by darkness…","13,387",270,Paperback,"9,387"
914,A Walk in the Woods: Rediscovering America on the Appalachian Trail,Bill Bryson,4.06,"417,955","First published May 5, 1998","The Appalachian Trail stretches from Georgia to Maine and covers some of the most breathtaking terrain in America—majestic mountains, silent forests, sparking lakes. If you’re going to take a hike, it’s probably the place to go. And Bill Bryson is surely the most entertaining guide you’ll find. He introduces us to the history and ecology of the trail and to some of the other hardy (or just foolhardy) folks he meets along the way—and a couple of bears. Already a classic, ","22,732",397,Mass Market Paperback,"9,535"
913,Gift from the Sea,Anne Morrow Lindbergh,4.14,"52,689","First published January 1, 1955","In this inimitable, beloved classic—graceful, lucid and lyrical—Anne Morrow Lindbergh shares her meditations on youth and age; love and marriage; peace, solitude and contentment as she set them down during a brief vacation by the sea. Drawing inspiration from the shells on the shore, Lindbergh’s musings on the shape of a woman’s life bring new understanding to both men and women at any stage of life. A mother of five, an acclaimed writer and a pioneering aviator, Lindbergh casts an unsentimental eye on the trappings of modernity that threaten to overwhelm us: the time-saving gadgets that complicate rather than simplify, the multiple commitments that take us from our families. And by recording her thoughts during a brief escape from everyday demands, she helps readers find a space for contemplation and creativity within their own lives.","5,340",130,Paperback,"9,542"
920,"Walking Disaster (Beautiful, #2)",Jamie McGuire,4.15,"200,280","First published April 2, 2013","Finally, the highly anticipated follow-up to the New York Times bestseller Beautiful Disaster.","12,820",448,Paperback,"9,461"
911,The Fall,Albert Camus,4.04,"113,399","First published May 16, 1956","Jean-Baptiste Clamence is a soul in turmoil. Over several drunken nights in an Amsterdam bar, he regales a chance acquaintance with his story. From this successful former lawyer and seemingly model citizen a compelling, self-loathing catalogue of guilt, hypocrisy and alienation pours forth.","7,014",147,Paperback,"9,578"
925,"A Study in Scarlet (Sherlock Holmes, #1)",Arthur Conan Doyle,4.14,"458,521","First published January 1, 1887","Our first meeting with Sherlock Holmes. And John Watson's too! The young doctor is astonished by Holmes' many idiosyncrasies, including his talents on the violin.","18,112",123,Paperback,"9,365"
915,"The Monarch's Ring (The Lost Artefacts, #2)",Johnathon Nicolaou,4.48,406,"First published May 4, 2022","The group is split up. They were betrayed. Lincoln and Liv are trapped in the lost dimension, Nowhere and El and AJ are under house arrest, all the while their enemies grow closer to discovering the whereabouts of Gedeon’s lost ring…",25,344,Kindle Edition,"9,524"
910,Between Shades of Gray,Ruta Sepetys,4.37,"252,201","First published March 22, 2011","Lina is just like any other fifteen-year-old Lithuanian girl in 1941. She paints, she draws, she gets crushes on boys. Until one night when Soviet officers barge into her home, tearing her family from the comfortable life they've known. Separated from her father, forced onto a crowded and dirty train car, Lina, her mother, and her young brother slowly make their way north, crossing the Arctic Circle, to a work camp in the coldest reaches of Siberia. Here they are forced, under Stalin's orders, to dig for beets and fight for their lives under the cruelest of conditions.","27,834",344,Hardcover,"9,583"
908,"84, Charing Cross Road",Helene Hanff,4.16,"86,534","First published January 1, 1970","This charming classic, first published in 1970, brings together twenty years of correspondence between Helene Hanff, a freelance writer living in New York City, and a used-book dealer in London. Through the years, though never meeting and separated both geographically and culturally, they share a winsome, sentimental friendship based on their common love for books. Their relationship, captured so acutely in these letters, is one that will grab your heart and not let go.","13,949",106,Paperback,"9,631"
918,"Kane & Abel (Kane & Abel, #1)",Jeffrey Archer,4.34,"124,410","First published January 1, 1979","Born on the same day near the turn of the century on opposite sides of the world, both men are brought together by fate and the quest of a dream. These two men -- ambitious, powerful, ruthless -- are locked in a relentless struggle to build an empire, fuelled by their all-consuming hatred. Over 60 years and three generations, through war, marriage, fortune, and disaster, Kane and Abel battle for the success and triumph that only one man can have.","6,126",592,Paperback,"9,481"
905,Mystic River,Dennis Lehane,4.17,"148,132","First published January 1, 2001","When they were children, Sean Devine, Jimmy Marcus, and Dave Boyle were friends. But then a strange car pulled up to their street. One boy got into the car, two did not, and something terrible happened -- something that ended their friendship and changed all three boys forever.","5,253",416,Paperback,"9,655"
916,Illusions: The Adventures of a Reluctant Messiah,Richard Bach,4.15,"64,785","First published January 1, 1977","In the cloud-washed airspace between the cornfields of Illinois and blue infinity, a man puts his faith in the propeller of his biplane. For disillusioned writer and itinerant barnstormer Richard Bach, belief is as real as a full tank of gas and sparks firing in the cylinders...until he meets Donald Shimoda — former mechanic and self-described messiah who can make wrenches fly and Richard's imagination soar....","2,952",144,Paperback,"9,517"
904,"Forrest Gump (Forrest Gump, #1)",Winston Groom,4.02,"69,703","First published December 31, 1986","Meet Forrest Gump, the lovable, herculean, and surprisingly savvy hero of this remarkable comic odyssey. After accidentally becoming the star of University of Alabama's football team, Forrest goes on to become a Vietnam War hero, a world-class Ping-Pong player, a villainous wrestler, and a business tycoon -- as he wonders with childlike wisdom at the insanity all around him. In between misadventures, he manages to compare battle scars with Lyndon Johnson, discover the truth about Richard Nixon, and survive the ups and downs of remaining true to his only love, Jenny, on an extraordinary journey through three decades of the American cultural landscape. Forrest Gump has one heck of a story to tell -- and you've got to read it to believe it...","3,330",248,Paperback,"9,678"
901,"Good Girl, Bad Blood (A Good Girl's Guide to Murder, #2)",Holly  Jackson,4.29,"582,550","First published April 30, 2020",Pip is not a detective anymore.,"63,562",413,Paperback,"9,727"
909,Exodus,Leon Uris,4.34,"100,091","First published September 1, 1958"," is an international publishing phenomenon--the towering novel of the twentieth century's most dramatic geopolitical event. Leon Uris magnificently portrays the birth of a new nation in the midst of enemies--the beginning of an earthshaking struggle for power. Here is the tale that swept the world with its fury: the story of an American nurse, an Israeli freedom fighter caught up in a glorious, heartbreaking, triumphant era.","2,226",599,Mass Market Paperback,"9,594"
889,"The Assassin's Blade (Throne of Glass, #0.1-0.5)",Sarah J. Maas,4.22,"747,151","First published March 4, 2014","Celaena Sardothien is Adarlan's most feared assassin. As part of the Assassin's Guild, her allegiance is to her master, Arobynn Hamel, yet Celaena listens to no one and trusts only her fellow killer-for-hire, Sam. In these action-packed novellas - together in one edition for the first time - Celaena embarks on five daring missions. They take her from remote islands to hostile deserts, where she fights to liberate slaves and seeks to avenge the tyrannous. But she is acting against Arobynn's orders and could suffer an unimaginable punishment for such treachery. Will Celaena ever be truly free? Explore the dark underworld of this kick-ass heroine to find out.","69,316",448,ebook,"9,947"
907,"Winter (The Lunar Chronicles, #4)",Marissa Meyer,4.42,"289,110","First published November 10, 2015","Princess Winter is admired for her grace, kindness and beauty, despite the scars on her face. She's said to be even more breath-taking than her stepmother, Queen Levana...","32,607",827,Hardcover,"9,637"
912,Hello Beautiful,Ann Napolitano,4.16,"381,886","First published March 14, 2023","William Waters grew up in a house silenced by tragedy, where his parents could hardly bear to look at him, much less love him. So it’s a relief when his skill on the basketball court earns him a scholarship to college, far away from his childhood home. He soon meets Julia Padavano, a spirited and ambitious young woman who surprises William with her appreciation of his quiet steadiness. With Julia comes her family; she is inseparable from her three younger sisters: Sylvie, the dreamer, is happiest with her nose in a book and imagines a future different from the expected path of wife and mother; Cecelia, the family’s artist; and Emeline, who patiently takes care of all of them. Happily, the Padavanos fold Julia’s new boyfriend into their loving, chaotic household.","35,980",416,Kindle Edition,"9,566"
888,"Finale (Hush, Hush, #4)",Becca Fitzpatrick,4.12,"179,030","First published October 1, 2012","Nora and Patch thought their troubles were behind them. Hank is gone and they should be able to put his ugly vendetta to rest. But in Hank's absence, Nora has become the unwitting head of the Nephilim and must finish what Hank began. Which ultimately means destroying the fallen angels - destroying Patch.","9,632",466,Hardcover,"9,965"
884,The Three Witches and the Master,Max Nowaz,,,,,,,,"10,039"
886,"The Eden Paradox (Eden Paradox, #1)",Barry Kirwan,4.23,"16,079","First published February 16, 2011","In 2063, Earth's overheated climate and war-ravaged cities are near breaking point. A new habitable planet is discovered within reach, but the first two missions have failed to return. This is the story of the third mission to Eden. What really awaits the crew of four as they make the long journey to this supposed uninhabited virgin planet, and what is the link to the secret 900 year old sect known as Alicians back on Earth? While Blake leads the Eden mission, a young researcher named Micah discovers a terrible truth that threatens the very existence of humanity.",206,392,Kindle Edition,"10,002"
906,"Daughter of the Forest  (Sevenwaters, #1)",Juliet Marillier,4.28,"67,011","First published April 1, 1999","Lovely Sorcha is the seventh child and only daughter of Lord Colum of Sevenwaters. Bereft of a mother, she is comforted by her six brothers who love and protect her. Sorcha is the light in their lives: they are determined that she know only contentment.","5,646",554,Mass Market Paperback,"9,640"
887,"Keeper of the Lost Cities (Keeper of the Lost Cities, #1)",Shannon Messenger,4.41,"85,914","First published October 2, 2012",Twelve-year-old Sophie Foster has a secret. She’s a Telepath—someone who hears the thoughts of everyone around her. It’s a talent she’s never known how to explain.,"8,900",496,Hardcover,"9,980"
881,Starship Troopers,Robert A. Heinlein,4.01,"232,355","First published December 1, 1959","The historians can’t seem to settle whether to call this one ""The Third Space War"" (or the fourth), or whether ""The First Interstellar War"" fits it better. We just call it “The Bug War."" Everything up to then and still later were ""incidents,"" ""patrols,"" or ""police actions."" However, you are just as dead if you buy the farm in an ""incident"" as you are if you buy it in a declared war...","7,717",264,Mass Market Paperback,"10,055"
883,I Am the Messenger,Markus Zusak,4.03,"163,567","First published January 10, 2002","Ed Kennedy is an underage cabdriver without much of a future. He's pathetic at playing cards, hopelessly in love with his best friend, Audrey, and utterly devoted to his coffee-drinking dog, the Doorman. His life is one of peaceful routine and incompetence until he inadvertently stops a bank robbery.","16,354",357,Paperback,"10,042"
901,Ethan Frome,Edith Wharton,3.44,"129,831","First published January 1, 1911","The classic novel of despair, forbidden emotions, and sexual undercurrents set against the austere New England countryside","7,829",99,Paperback,"9,727"
878,"The Restaurant at the End of the Universe (The Hitchhiker's Guide to the Galaxy, #2)",Douglas Adams,4.20,"296,868","First published October 12, 1980","Facing annihilation at the hands of the warlike Vogons is a curious time to have a cosmically displaced Arthur Dent and his curious comrades in arms as they hurtle through space powered by pure improbability - and desperately in search of a place to eat. Among Arthur's motley shipmates are Ford Prefect, a long-time friend and contributor to the The Hitch Hiker's Guide to the Galaxy; Zaphod Beeblebrox, the three-armed, two-headed ex-president of the galaxy; Tricia McMilan, a fellow Earth refuge who's gone native (her name is Trillian now); and Marvin, who suffers nothing and no one gladly.","9,178",250,Paperback,"10,133"
877,The Namesake,Jhumpa Lahiri,4.02,"273,995","First published September 16, 2003",Jhumpa Lahiri's ,"15,383",291,Paperback,"10,213"
875,The Portrait of a Lady,Henry James,3.79,"82,168","First published January 1, 1881","When Isabel Archer, a beautiful, spirited American, is brought to Europe by her wealthy Aunt Touchett, it is expected that she will soon marry. But Isabel, resolved to determine her own fate, does not hesitate to turn down two eligible suitors. She then finds herself irresistibly drawn to Gilbert Osmond, who, beneath his veneer of charm and cultivation, is cruelty itself. A story of intense poignancy, Isabel's tale of love and betrayal still resonates with modern audiences.","4,017",797,Paperback,"10,318"
879,Choke,Chuck Palahniuk,3.71,"213,633","First published May 22, 2001","Needing to pay elder care for his mother, Victor has devised an ingenious scam: he pretends to choke on pieces of food while dining in upscale restaurants. He then allows himself to be “saved” by fellow patrons who, feeling responsible for Victor’s life, go on to send checks to support him.","7,463",293,Paperback,"10,101"
880,"Worm Holes (Quantum Roots, #2)",Kyle Keyes,4.34,"2,111","First published February 12, 2017","In this sequel to Quantum Roots, the meekish Olan Chapman faces danger as vigilante Samuel Leroy McCoy, a US deputy marshal who upheld law and order in 1876, Dodge City.",43,296,Paperback,"10,073"
903,The Sea of Tranquility,Katja Millay,4.29,"87,269","First published September 5, 2012","Former piano prodigy Nastya Kashnikov wants two things: to get through high school without anyone learning about her past and to make the boy who took everything from her—her identity, her spirit, her will to live—pay.","10,485",449,Kindle Edition,"9,707"
885,Let the Right One In,John Ajvide Lindqvist,4.04,"113,717","First published May 1, 2004","It is autumn 1981 when the inconceivable comes to Blackeberg, a suburb in Sweden. The body of a teenage boy is found, emptied of blood, the murder rumored to be part of a ritual killing. Twelve-year-old Oskar is personally hoping that revenge has come at long last—revenge for the bullying he endures at school, day after day.","7,811",513,Hardcover,"10,025"
874,"Fire (Graceling Realm, #2)",Kristin Cashore,4.10,"188,868","First published October 5, 2009",It is not a peaceful time in the Dells. The young King Nash clings to his throne while rebel lords in the north and south build armies to unseat him. The mountains and forests are filled with spies and thieves and lawless men.,"12,327",480,Hardcover,"10,344"
882,Wild Swans: Three Daughters of China,Jung Chang,4.29,"115,487","First published January 1, 1991",Alternate cover edition of ISBN ,"7,514",562,Paperback,"10,045"
873,My Name Is Asher Lev,Chaim Potok,4.23,"42,034","First published January 1, 1972",.,"3,296",369,Paperback,"10,376"
868,Holy Bible: New International Version,Anonymous,4.62,"89,820","First published January 1, 1455",The New International Version is the world's most popular Bible in modern English and is renowned for its combination of accuracy and clarity of language.,"3,304",1213,Hardcover,"10,435"
866,Meditations,Marcus Aurelius,4.28,"270,600","First published January 1, 180","Written in Greek by the only Roman emperor who was also a philosopher, without any intention of publication, the ","15,549",254,Paperback,"10,456"
865,The 7 Habits of Highly Effective People: Powerful Lessons in Personal Change,Stephen R. Covey,4.16,"761,524","First published January 1, 1989",7 zakonet e njerëzve të suksesshëm,"15,262",372,Paperback,"10,463"
871,Chasing the Devil: The Search for Africa's Fighting Spirit,Tim Butcher,4.13,"1,897","First published September 2, 2010","For many years Sierra Leone and Liberia have been too dangerous to travel through, bedevilled by a uniquely brutal form of violence from which sprang many of Africa's cruellest contemporary icons. This travel book touches on one of the most fraught parts of the globe at a different moment in its history.",205,336,Hardcover,"10,387"
864,The Lost Artefacts - The Complete Collection,Johnathon Nicolaou,4.55,165,"Published July 30, 2024",The Complete Collection - Books 1-5,11,757,Paperback,"10,492"
876,Howards End,E.M. Forster,3.96,"91,198","First published October 18, 1910","A már életében klasszikusnak számító angol írónak ez volt a negyedik, a kritikusok szerint a legjobb regénye. Ismét életre kel az Edward-kori Anglia. A történet középpontjában két család áll. Egyrészt a dúsgazdag Wilcoxék: Henry, a hűvösen charme-os vállalkozó, és beteges felesége, Ruth. Másrészről a művelt, érzékeny Schlegel kisasszonyok, akik intellektuális lelkivilágukat a londoni teaszalonokban élik. A két életforma között és alatt Leonard Bast, a Helen Schlegel védőszárnyai alá került fiatal hivatalnok tengődik, a kisember, aki a kultúra világába vágyakozik, de akit a wilcoxi könyörtelenség és a schlegeli könyörület egymással versengve tesz tönkre.","4,496",318,Paperback,"10,307"
863,The Omnivore's Dilemma: A Natural History of Four Meals,Michael Pollan,4.18,"206,186","First published April 11, 2006"," For omnivore like ourselves, this simple question has always posed a dilemma. When you can eat just about anything nature (or the supermarket) has to offer, deciding what you ","14,334",450,Hardcover,"10,497"
871,"Mort (Discworld, #4; Death, #1)",Terry Pratchett,4.24,"253,142","First published November 12, 1987","Death comes to us all. When he came to Mort, he offered him a job.","8,800",243,Mass Market Paperback,"10,387"
870,The Moon Is a Harsh Mistress,Robert A. Heinlein,4.15,"132,854","First published June 2, 1966","It is a tale of revolution, of the rebellion of a former penal colony on the Moon against its masters on the Earth. It is a tale of a culture whose family structures are based on the presence of two men for every woman, leading to novel forms of marriage and family. It is the story of the disparate people, a computer technician, a vigorous young female agitator, and an elderly academic who become the movement's leaders, and of Mike, the supercomputer whose sentience is known only to the revolt's inner circle, who for reasons of his own is committed to the revolution's ultimate success.","5,211",288,Paperback,"10,409"
859,Naked Lunch,William S. Burroughs,3.46,"93,298","First published July 1, 1959","The book is structured as a series of loosely connected vignettes. Burroughs stated that the chapters are intended to be read in any order. The reader follows the narration of junkie William Lee, who takes on various aliases, from the U.S. to Mexico, eventually to Tangier and the dreamlike Interzone.","5,109",289,Paperback,"10,588"
861,Jude the Obscure,Thomas Hardy,3.83,"72,943","First published April 16, 1895","Jude Fawley's hopes of a university education are lost when he is trapped into marrying the earthy Arabella, who later abandons him. Moving to the town of Christminster where he finds work as a stonemason, Jude meets and falls in love with his cousin Sue Bridehead, a sensitive, freethinking 'New Woman'.","4,388",310,Paperback,"10,513"
867,"Mary Poppins (Mary Poppins, #1)",P.L. Travers,4.01,"135,422","First published January 1, 1934","By P.L. Travers, the author featured in the major motion picture, ","7,048",209,Hardcover,"10,439"
869,"Scythe (Arc of a Scythe, #1)",Neal Shusterman,4.33,"341,984","First published November 22, 2016","A world with no hunger, no disease, no war, no misery. Humanity has conquered all those things, and has even conquered death. Now scythes are the only ones who can end life—and they are commanded to do so, in order to keep the size of the population under control.","48,443",435,Hardcover,"10,415"
856,"Lover Avenged (Black Dagger Brotherhood, #7)",J.R. Ward,4.36,"116,883","First published April 28, 2009","Rehvenge has always kept his distance from the Brotherhood—even though his sister is married to a member, for he harbors a deadly secret that could make him a huge liability in their war against the lessers. As plots within and outside of the Brotherhood threaten to reveal the truth about Rehvenge, he turns to the only source of light in his darkening world, Ehlena, a vampire untouched by the corruption that has its hold on him—and the only thing standing between him and eternal destruction.","4,391",527,Hardcover,"10,636"
