Rank,Title,Author,Rating,Number of Ratings,Date,Description,Reviews,Pages,Cover Type,Score
321,"The Wise Man’s Fear (The Kingkiller Chronicle, #2)",Patrick Rothfuss,4.55,"573,967","First published March 1, 2011",“,"28,345",994,Hardcover,"46,552"
316,"Lamb: The Gospel According to Biff, Christ’s Childhood Pal",Christopher Moore,4.23,"176,123","First published March 1, 2002","The birth of Jesus has been well chronicled, as have his glorious teachings, acts, and divine sacrifice after his thirtieth birthday. But no one knows about the early life of the Son of God, the missing years—except Biff, the Messiah's best bud, who has been resurrected to tell the story in the divinely hilarious yet heartfelt work ""reminiscent of Vonnegut and Douglas Adams"" (","13,216",444,Paperback,"47,548"
315,Paradise Lost,John Milton,3.85,"169,749","First published January 1, 1667",John Milton's ,"6,095",512,Paperback,"47,647"
317,The Complete Works,William Shakespeare,4.48,"57,189","First published January 1, 1623",Tempest	,"1,111",1229,Leather Bound,"47,395"
314,Candide,Voltaire,3.76,"282,616","First published January 1, 1759"," is the story of a gentle man who, though pummeled and slapped in every direction by fate, clings desperately to the belief that he lives in ""the best of all possible worlds."" On the surface a witty, bantering tale, this eighteenth-century classic is actually a savage, satiric thrust at the philosophical optimism that proclaims that all disaster and human suffering is part of a benevolent cosmic plan. Fast, funny, often outrageous, the French philosopher's immortal narrative takes Candide around the world to discover that -- contrary to the teachings of his distinguished tutor Dr. Pangloss -- all is not always for the best. Alive with wit, brilliance, and graceful storytelling, ","12,131",129,Paperback,"47,750"
313,Flow Down Like Silver,Ki Longfellow,4.01,"4,506","First published August 20, 2009","Ki Longfellow, author of the acclaimed ",231,301,Paperback,"47,789"
312,The Time Machine,H.G. Wells,3.89,"531,118","First published January 1, 1895",“I’ve had a most amazing time....”,"17,026",118,Paperback,"47,796"
318,"The Son of Neptune (The Heroes of Olympus, #2)",Rick Riordan,4.41,"614,906","First published October 4, 2011"," When he awoke from his long sleep, he didn't know much more than his name. His brain fuzz is lingering, even after the wolf Lupa told him he is a demigod and trained him to fight with the pen/sword in his pocket. Somehow Percy manages to make it to a camp for half-bloods, despite the fact that he has to keep killing monsters along the way. But the camp doesn't ring any bells with him. The only thing he can recall from his past is another name: ","26,203",521,Hardcover,"46,951"
308,I Know This Much Is True,Wally Lamb,4.21,"315,411","First published June 14, 1998","On the afternoon of October 12, 1990, my twin brother, Thomas, entered the Three Rivers, Connecticut, public library, retreated to one of the rear study carrels, and prayed to God the sacrifice he was about to commit would be deemed acceptable. . . .","10,525",897,Paperback,"48,474"
311,The Historian,Elizabeth Kostova,3.80,"268,688","First published June 14, 2005","To you, perceptive reader, I bequeath my history....Late one night, exploring her father's library, a young woman finds an ancient book and a cache of yellowing letters. The letters are all addressed to ""My dear and unfortunate successor,"" and they plunge her into a world she never dreamed of, a labyrinth where the secrets of her father's past and her mother's mysterious fate connect to an inconceivable evil hidden in the depths of history.","18,584",704,Kindle Edition,"48,095"
304,Midnight Sun [2008 Draft],Stephenie Meyer,4.01,"148,864","First published August 28, 2008", ,"9,303",264,ebook,"48,934"
310,James and the Giant Peach,Roald Dahl,4.03,"484,814","First published November 1, 1961","James Henry Trotter lives with two ghastly hags. Aunt Sponge is enormously fat with a face that looks boiled and Aunt Spiker is bony and screeching. He's very lonely until one day something peculiar happens. . . At the end of the garden a peach starts to grow and GROW AND GROW. Inside that peach are seven very unusual insects - all waiting to take James on a magical adventure. But where will they go in their GIANT PEACH, and what will happen to the horrible aunts if they stand in their way? There's only one way to find out . . .","9,267",176,Hardcover,"48,123"
309,"Ready Player One (Ready Player One, #1)",Ernest Cline,4.23,"1,204,773","First published August 16, 2011"," The only time teenage Wade Watts really feels alive is when he's jacked into the virtual utopia known as the OASIS. Wade's devoted his life to studying the puzzles hidden within this world's digital confines, puzzles that are based on their creator's obsession with the pop culture of decades past and that promise massive power and fortune to whoever can unlock them. ","104,577",374,Hardcover,"48,364"
307,"Shatter Me (Shatter Me, #1)",Tahereh Mafi,3.85,"976,981","First published November 15, 2011",I have a gift,"97,141",338,Hardcover,"48,480"
302,"Foundation (Foundation, #1)",Isaac Asimov,4.17,"554,024","First published August 30, 1951","For twelve thousand years the Galactic Empire has ruled supreme. Now it is dying. But only Hari Seldon, creator of the revolutionary science of psychohistory, can see into the future--to a dark age of ignorance, barbarism, and warfare that will last thirty thousand years. To preserve knowledge and save humankind, Seldon gathers the best minds in the Empire--both scientists and scholars--and brings them to a bleak planet at the edge of the galaxy to serve as a beacon of hope for future generations. He calls his sanctuary the Foundation.","17,387",244,Hardcover,"49,430"
303,"Wonder (Wonder, #1)",R.J. Palacio,4.37,"1,116,837","First published February 14, 2012","August Pullman was born with a facial difference that, up until now, has prevented him from going to a mainstream school. Starting 5th grade at Beecher Prep, he wants nothing more than to be treated as an ordinary kid—but his new classmates can’t get past Auggie’s extraordinary face. ","77,179",315,Hardcover,"49,084"
306,The Once and Future King,T.H. White,4.07,"114,044","First published January 1, 1958","T.H White′s masterful retelling of the Arthurian legend is an abiding classic. Here all five volumes that make up the story are published in one volume, as White himself always wished. Exquisite comedy offsets the tragedy of Arthur′s personal doom as White brings to life the major British epic of all time with brilliance, grandeur, warmth and charm.","5,388",639,Mass Market Paperback,"48,739"
285,Othello,William Shakespeare,3.89,"402,362","First published January 1, 1603","In Othello, Shakespeare creates a powerful drama of a marriage that begins with fascination (between the exotic Moor Othello and the Venetian lady Desdemona), with elopement, and with intense mutual devotion and that ends precipitately with jealous rage and violent deaths. He sets this story in the romantic world of the Mediterranean, moving the action from Venice to the island of Cyprus and giving it an even more exotic coloring with stories of Othello's African past. Shakespeare builds so many differences into his hero and heroine—differences of race, of age, of cultural background—that one should not, perhaps, be surprised that the marriage ends disastrously. But most people who see or read the play feel that the love that the play presents between Othello and Desdemona is so strong that it would have overcome all these differences were it not for the words and actions of Othello's standard-bearer, Iago, who hates Othello and sets out to destroy him by destroying his love for Desdemona. As Othello succumbs to Iago's insinuations that Desdemona is unfaithful, fascination—which dominates the early acts of the play—turns to horror, especially for the audience. We are confronted by spectacles of a generous and trusting Othello in the grip of Iago's schemes; of an innocent Desdemona, who has given herself up entirely to her love for Othello only to be subjected to his horrifying verbal and physical assaults, the outcome of Othello's mistaken convictions about her faithlessness.","11,151",319,Mass Market Paperback,"53,102"
286,Into the Wild,Jon Krakauer,4.01,"1,114,976","First published January 13, 1996","In April, 1992, a young man from a well-to-do family hitchhiked to Alaska and walked alone into the wilderness north of Mt. McKinley. His name was Christopher Johnson McCandless. He had given $25,000 in savings to charity, abandoned his car and most of his possessions, burned all the cash in his wallet, and invented a new life for himself. Four months later, a party of moose hunters found his decomposed body. How McCandless came to die is the unforgettable story of ","29,744",207,Paperback,"52,992"
305,"All Creatures Great and Small (All Creatures Great and Small, #1-2)",James Herriot,4.35,"149,673","First published January 1, 1972",The classic multimillion copy bestseller,"7,411",437,Mass Market Paperback,"48,833"
284,Stranger in a Strange Land,Robert A. Heinlein,3.92,"316,535","First published July 1, 1961","Valentine Michael Smith is a human being raised on Mars, newly returned to Earth. Among his people for the first time, he struggles to understand the social mores and prejudices of human nature that are so alien to him, while teaching them his own fundamental beliefs in grokking, watersharing, and love.","10,298",525,Paperback,"53,388"
301,Different Seasons,Stephen         King,4.35,"209,464","First published January 1, 1982","Includes the stories “The Body” and “Rita Hayworth and Shawshank Redemption”—set in the fictional town of Castle Rock, Maine","6,618",560,Mass Market Paperback,"49,814"
283,The Complete Sherlock Holmes,Arthur Conan Doyle,4.50,"209,329","First published January 1, 1905",A study in scarlet --,"5,177",1796,Paperback,"53,463"
281,Roots: The Saga of an American Family,Alex Haley,4.44,"161,027","First published August 17, 1976","When he was a boy in Henning, Tennessee, Alex Haley's grandmother used to tell him stories about their family—stories that went back to ","4,316",729,Mass Market Paperback,"53,626"
280,Kafka on the Shore,Haruki Murakami,4.13,"490,569","First published September 1, 2002",", a tour de force of metaphysical reality, is powered by two remarkable characters: a teenage boy, Kafka Tamura, who runs away from home either to escape a gruesome oedipal prophecy or to search for his long-missing mother and sister; and an aging simpleton called Nakata, who never recovered from a wartime affliction and now is drawn toward Kafka for reasons that, like the most basic activities of daily life, he cannot fathom. Their odyssey, as mysterious to them as it is to us, is enriched throughout by vivid accomplices and mesmerizing events. Cats and people carry on conversations, a ghostlike pimp employs a Hegel-quoting prostitute, a forest harbors soldiers apparently unaged since World War II, and rainstorms of fish (and worse) fall from the sky. There is a brutal murder, with the identity of both victim and perpetrator a riddle—yet this, along with everything else, is eventually answered, just as the entwined destinies of Kafka and Nakata are gradually revealed, with one escaping his fate entirely and the other given a fresh start on his own.","40,197",467,Paperback,"54,295"
282,Paper Towns,John Green,3.71,"1,400,790","First published October 16, 2008","Quentin Jacobsen has spent a lifetime loving the magnificently adventurous Margo Roth Spiegelman from afar. So when she cracks open a window and climbs into his life—dressed like a ninja and summoning him for an ingenious campaign of revenge—he follows. After their all-nighter ends, and a new day breaks, Q arrives at school to discover that Margo, always an enigma, has now become a mystery. But Q soon learns that there are clues—and they're for him. Urged down a disconnected path, the closer he gets, the less Q sees the girl he thought he knew...","56,869",305,Paperback,"53,582"
279,Island of the Blue Dolphins,Scott O'Dell,3.87,"337,707","First published September 9, 1960","In the Pacific there is an island that looks like a big fish sunning itself in the sea. Around it, blue dolphins swim, otters play, and sea elephants and sea birds abound. Once, Indians also lived on the island. And when they left and sailed to the east, one young girl was left behind. — This is the story of Karana, the Indian girl who lived alone for years on the Island of the Blue Dolphins. Year after year, she watched one season pass into another and waited for a ship to take her away. But while she waited, she kept herself alive by building shelter, making weapons, finding food, and fighting her enemies, the wild dogs. It is not only an unusual adventure of survival, but also a tale of natural beauty and personal discovery.","10,257",194,Kindle Edition,"54,300"
276,The Complete Calvin and Hobbes,Bill Watterson,4.81,"40,834","First published September 6, 2005",[ ,"1,206",1456,Hardcover,"55,273"
278,"The Way of Kings (The Stormlight Archive, #1)",Brandon Sanderson,4.66,"533,802","First published August 31, 2010","Roshar is a world of stone and storms. Uncanny tempests of incredible power sweep across the rocky terrain so frequently that they have shaped ecology and civilization alike. Animals hide in shells, trees pull in branches, and grass retracts into the soilless ground. Cities are built only where the topography offers shelter.","39,886",1007,Hardcover,"54,896"
277,For Whom the Bell Tolls,Ernest Hemingway,3.98,"299,761","First published October 1, 1940","In 1937 Ernest Hemingway traveled to Spain to cover the civil war there for the North American Newspaper Alliance. Three years later he completed the greatest novel to emerge from ""the good fight,"" ","9,459",471,Paperback,"55,153"
273,Fear and Loathing in Las Vegas,Hunter S. Thompson,4.07,"356,734","First published July 7, 1971"," is the best chronicle of drug-soaked, addle-brained, rollicking good times ever committed to the printed page. It is also the tale of a long weekend road trip that has gone down in the annals of American pop culture as one of the strangest journeys ever undertaken.","9,976",204,Paperback,"55,626"
275,The Sound and the Fury,William Faulkner,3.86,"185,623","First published October 7, 1929","The tragedy of the Compson family features some of the most memorable characters in literature: beautiful, rebellious Caddy; the manchild Benjy; haunted, neurotic Quentin; Jason, the brutal cynic; and Dilsey, their black servant. Their lives fragmented and harrowed by history and legacy, the character’s voices and actions mesh to create what is arguably Faulkner’s masterpiece and one of the greatest novels of the twentieth century.","9,744",366,Paperback,"55,525"
274,The Shack: Where Tragedy Confronts Eternity,William Paul Young,3.83,"660,804","First published May 1, 2007","Mackenzie Allen Philips' youngest daughter, Missy, has been abducted during a family vacation and evidence that she may have been brutally murdered is found in an abandoned shack deep in the Oregon wilderness. Four years later in the midst of his Great Sadness, Mack receives a suspicious note, apparently from God, inviting him back to that shack for a weekend. Against his better judgment he arrives at the shack on a wintry afternoon and walks back into his darkest nightmare. What he finds there will change Mack's world forever.","36,049",294,Kindle Edition,"55,590"
271,Speak,Laurie Halse Anderson,4.05,"603,822","First published October 22, 1999",The first ten lies they tell you in high school.,"31,933",224,Hardcover,"56,528"
268,"Shiver (The Wolves of Mercy Falls, #1)",Maggie Stiefvater,3.76,"485,848","First published August 1, 2009","For years, Grace has watched the wolves in the woods behind her house. One yellow-eyed wolf—her wolf—is a chilling presence she can't seem to live without.","25,196",392,Hardcover,"57,103"
267,The Guernsey Literary and Potato Peel Pie Society,Mary Ann Shaffer,4.19,"768,425","First published July 29, 2008","January 1946: London is emerging from the shadow of the Second World War, and writer Juliet Ashton is looking for her next book subject. Who could imagine that she would find it in a letter from a man she's never met, a native of the island of Guernsey, who has come across her name written inside a book by Charles Lamb...","63,277",291,Paperback,"57,536"
266,She’s Come Undone,Wally Lamb,3.91,"350,711","First published August 24, 1992","In this extraordinary coming-of-age odyssey, Wally Lamb invites us to hitch a wild ride on a journey of love, pain, and renewal with the most heartbreakingly comical heroine to come along in years.","11,473",465,Mass Market Paperback,"57,635"
270,"Crooked Kingdom (Six of Crows, #2)",Leigh Bardugo,4.59,"676,747","First published September 27, 2016",Welcome to the world of the Grisha.,"75,692",561,Kindle Edition,"57,037"
272,"Marked (House of Night, #1)",P.C. Cast,3.81,"504,473","First published May 1, 2007", ,"16,638",306,Paperback,"56,456"
269,Norwegian Wood,Haruki Murakami,4.01,"636,183","First published September 4, 1987","Toru, a quiet and preternaturally serious young college student in Tokyo, is devoted to Naoko, a beautiful and introspective young woman, but their mutual passion is marked by the tragic death of their best friend years before. Toru begins to adapt to campus life and the loneliness and isolation he faces there, but Naoko finds the pressures and responsibilities of life unbearable. As she retreats further into her own world, Toru finds himself reaching out to others and drawn to a fiercely independent and sexually liberated young woman. ","49,004",296,Paperback,"57,045"
265,The House of the Spirits,Isabel Allende,4.28,"281,157","First published January 1, 1982","In one of the most important and beloved Latin American works of the twentieth century, Isabel Allende weaves a luminous tapestry of three generations of the Trueba family, revealing both triumphs and tragedies. Here is patriarch Esteban, whose wild desires and political machinations are tempered only by his love for his ethereal wife, Clara, a woman touched by an otherworldly hand. Their daughter, Blanca, whose forbidden love for a man Esteban has deemed unworthy infuriates her father, yet will produce his greatest joy: his granddaughter Alba, a beautiful, ambitious girl who will lead the family and their country into a revolutionary future.","16,156",448,Paperback,"58,717"
262,"Uglies (Uglies, #1)",Scott Westerfeld,3.85,"677,428","First published February 8, 2005","Tally is about to turn sixteen, and she can't wait. In just a few weeks she'll have the operation that will turn her from a repellent ugly into a stunning pretty. And as a pretty, she'll be catapulted into a high-tech paradise where her only job is to have fun.","27,563",425,Paperback,"59,404"
264,Marley and Me: Life and Love With the World’s Worst Dog,John Grogan,4.14,"472,520","First published January 1, 2005","John and Jenny were young and deeply in love, with a perfect little house and not a care in the world. Then they brought home Marley, a wiggly yellow furball of a puppy. Life would never be the same.","15,121",291,Hardcover,"58,869"
263,The Wind-Up Bird Chronicle,Haruki Murakami,4.15,"292,100","First published April 12, 1994","Japan's most highly regarded novelist now vaults into the first ranks of international fiction writers with this heroically imaginative novel, which is at once a detective story, an account of a disintegrating marriage, and an excavation of the buried secrets of World War II. ","20,793",607,Paperback,"59,258"
261,"The Lord of the Rings (Middle Earth, #2-4)",J.R.R. Tolkien,4.53,"689,873","First published January 1, 1954","In ancient times the Rings of Power were crafted by the Elven-smiths, and Sauron, the Dark Lord, forged the One Ring, filling it with his own power so that he could rule all others. But the One Ring was taken from him, and though he sought it throughout Middle-earth, it remained lost to him. After many ages it fell by chance into the hands of the hobbit Bilbo Baggins.","15,064",1216,Paperback,"60,099"
258,"A Clash of Kings  (A Song of Ice and Fire, #2)",George R.R. Martin,4.42,"959,321","First published November 16, 1998","A comet the color of blood and flame cuts across the sky. Two great leaders—Lord Eddard Stark and Robert Baratheon—who hold sway over an age of enforced peace are dead, victims of royal treachery. Now, from the ancient citadel of Dragonstone to the forbidding shores of Winterfell, chaos reigns. Six factions struggle for control of a divided land and the Iron Throne of the Seven Kingdoms, preparing to stake their claims through tempest, turmoil, and war. ","28,925",1009,Paperback,"60,604"
257,The Hiding Place: The Triumphant True Story of Corrie Ten Boom,Corrie ten Boom,4.47,"332,799","First published January 1, 1971","At one time Corrie ten Boom would have laughed at the idea that there would ever be a story to tell. For the first fifty years of her life nothing at all out of the ordinary had ever happened to her. She was an old-maid watchmaker living contentedly with her spinster sister and their elderly father in the tiny Dutch house over their shop. Their uneventful days, as regulated as their own watches, revolved around their abiding love for one another. However, with the Nazi invasion and occupation of Holland, a story did ensue. ","14,267",242,Mass Market Paperback,"61,622"
255,Blindness,José Saramago,4.17,"301,685","First published January 1, 1995","A city is hit by an epidemic of ""white blindness"" that spares no one. Authorities confine the blind to an empty mental hospital, but there the criminal element holds everyone captive, stealing food rations, and assaulting women. There is one eyewitness to this nightmare who guides her charges—among them a boy with no mother, a girl with dark glasses, a dog of tears—through the barren streets, and their procession becomes as uncanny as the surroundings are harrowing. As ","25,226",349,Kindle Edition,"62,053"
259,"Ella Enchanted (Ella Enchanted, #1)",Gail Carson Levine,4.01,"416,488","First published April 25, 1997","At birth, Ella is inadvertently cursed by an imprudent young fairy named Lucinda, who bestows on her the ""gift"" of obedience. Anything anyone tells her to do, Ella must obey. Another girl might have been cowed by this affliction, but not feisty Ella: ""Instead of making me docile, Lucinda's curse made a rebel of me. Or perhaps I was that way naturally."" When her beloved mother dies, leaving her in the care of a mostly absent and avaricious father, and later, a loathsome stepmother and two treacherous stepsisters, Ella's life and well-being seem to be in grave peril. But her intelligence and saucy nature keep her in good stead as she sets out on a quest for freedom and self-discovery as she tries to track down Lucinda to undo the curse, fending off ogres, befriending elves, and falling in love with a prince along the way. Yes, there is a pumpkin coach, a glass slipper, and a happily ever after, but this is the most remarkable, delightful, and profound version of Cinderella you'll ever read.","12,615",240,Paperback,"60,541"
254,The God of Small Things,Arundhati Roy,3.96,"305,106","First published April 1, 1997","The year is 1969. In the state of Kerala, on the southernmost tip of India, a skyblue Plymouth with chrome tailfins is stranded on the highway amid a Marxist workers' demonstration. Inside the car sit two-egg twins Rahel and Esthappen, and so begins their tale. . . .","20,020",321,Paperback,"62,263"
260,Girl with a Pearl Earring,Tracy Chevalier,3.93,"747,810","First published January 1, 1999","With precisely 35 canvases to his credit, the Dutch painter Johannes Vermeer represents one of the great enigmas of 17th-century art. The meager facts of his biography have been gleaned from a handful of legal documents. Yet Vermeer's extraordinary paintings of domestic life, with their subtle play of light and texture, have come to define the Dutch golden age. His portrait of the anonymous Girl with a Pearl Earring has exerted a particular fascination for centuries—and it is this magnetic painting that lies at the heart of Tracy Chevalier's second novel of the same title.","12,907",233,Paperback,"60,440"
256,"Mockingjay (The Hunger Games, #3)",Suzanne Collins,4.09,"3,336,672","First published August 24, 2010","Katniss Everdeen, girl on fire, has survived, even though her home has been destroyed. Gale has escaped. Katniss's family is safe. Peeta has been captured by the Capitol. District 13 really does exist. There are rebels. There are new leaders. A revolution is unfolding.","134,024",390,Hardcover,"61,834"
253,"Spirit Bound (Vampire Academy, #5)",Richelle Mead,4.32,"298,763","First published May 18, 2010","The words stunned Adrian for a moment, but he kept going. ""You're lying. What you're describing is impossible. There's no way to save a Strigoi. When they're gone, they're gone. They're dead. Undead. Forever.""","10,319",489,Hardcover,"62,990"
252,"City of Fallen Angels (The Mortal Instruments, #4)",Cassandra Clare,4.08,"613,133","First published April 5, 2011","The Mortal War is over, and sixteen-year-old Clary Fray is back home in New York, excited about all the possibilities before her. She’s training to become a Shadowhunter and to use her unique power. Her mother is getting married to the love of her life. Downworlders and Shadowhunters are at peace at last. And—most importantly of all—she can finally call Jace her boyfriend.","28,202",425,Hardcover,"63,966"
251,The Wind in the Willows,Kenneth Grahame,4.02,"224,960","First published October 8, 1908","For more than a century, ","9,633",197,Paperback,"64,011"
